Question,Choice 1,Choice 2,Choice 3,Choice 4,Correct Answer (1-4),Explanation,Difficulty,Subject,Chapter,Topic
Wisdom in late adulthood is best understood as:,perfect memory for facts,superior sensorimotor speed,expert knowledge in the pragmatics of life,immunity from emotional distress,3,Wisdom involves practical judgment and life insight.,Medium,Developmental Psychology,Chapter 1,Chapter 1 Set 1
Erikson's final psychosocial crisis is:,intimacy versus isolation,ego integrity versus despair,initiative versus guilt,autonomy versus shame and doubt,2,Older adults evaluate their life with acceptance or regret.,Medium,Developmental Psychology,Chapter 1,Chapter 1 Set 1
Which situation best reflects ageism?,Providing accessible services to older adults,"Assuming all older adults are frail, forgetful, and resistant to change",Encouraging active aging,Adapting communication to sensory needs,2,Ageism involves stereotyping and discrimination based on age.,Medium,Developmental Psychology,Chapter 1,Chapter 1 Set 1
Disengagement theory proposes that:,older adults thrive by maximizing social roles,aging involves mutual withdrawal between person and society,social support becomes irrelevant in old age,loneliness is biologically predetermined,2,The theory suggests reduced interaction between older adults and society.,Medium,Developmental Psychology,Chapter 1,Chapter 1 Set 1
Activity theory would predict greater satisfaction in late adulthood when older adults:,remain socially and psychologically engaged,sever most social ties,avoid meaningful roles,depend entirely on institutions,1,Active engagement supports well-being in old age.,Medium,Developmental Psychology,Chapter 1,Chapter 1 Set 1
Which loss is often associated with the greatest long-term adjustment challenge in late adulthood?,Loss of a favorite television program,Loss of a spouse,Loss of a recreational hobby,Loss of an outdated work title,2,Spousal loss has profound emotional and adjustment impact.,Medium,Developmental Psychology,Chapter 1,Chapter 1 Set 1
Kubler-Ross's framework is most commonly associated with:,attachment categories,stages of grief and reactions to dying,moral development,intelligence testing,2,Kubler-Ross described emotional responses to death and dying.,Medium,Developmental Psychology,Chapter 1,Chapter 1 Set 1
A psychometrician is asked to conduct psychotherapy for an adolescent with depression in a routine outpatient setting. The best response is to:,provide therapy independently if the family insists,provide therapy only if no psychologist is available anywhere,"decline the therapy role and refer appropriately, unless it is an emergency situation",proceed as long as the client signs consent,3,Scope of practice limits psychometricians from independently providing psychotherapy.,Medium,Developmental Psychology,Chapter 1,Chapter 1 Set 1
A psychometrician administers a psychological test without required supervision and interprets results independently. The main ethical issue is:,overemphasis on confidentiality,practice beyond professional boundaries,excessive use of informed consent,failure to use a projective test,2,Practicing beyond defined roles violates ethical and legal standards.,Medium,Developmental Psychology,Chapter 1,Chapter 1 Set 1
A school requests raw test data from a psychometrician. The best action is to:,release all materials immediately,release only summaries to anyone,protect test data and release only to authorized individuals,post results publicly,3,Confidentiality and test security must be maintained.,Medium,Developmental Psychology,Chapter 1,Chapter 1 Set 1
"During teleassessment, disruptions affect test performance. The ethical response is to:",ignore the issue,continue without noting it,document limitations and consider effects on validity,adjust scores arbitrarily,3,Test validity must be preserved and limitations reported.,Medium,Developmental Psychology,Chapter 1,Chapter 1 Set 1
Sharing identifiable client information in class violates:,beneficence only,test standardization,confidentiality and privacy,informed assent,3,Client identity must be protected.,Medium,Developmental Psychology,Chapter 1,Chapter 1 Set 1
A practitioner notices unethical test use by a colleague. The best response is to:,ignore it,consider appropriate action and resolve if possible,publicly shame the colleague,immediately report without basis,2,Ethical practice requires appropriate and proportional response.,Medium,Developmental Psychology,Chapter 1,Chapter 1 Set 1
Delegating testing to an untrained assistant is unethical because:,delegation is never allowed,tasks must only be delegated to competent individuals,assistants can only schedule,two psychologists are always required,2,Delegation requires proper training and supervision.,Medium,Developmental Psychology,Chapter 1,Chapter 1 Set 1
A client chooses to terminate therapy early. The ethical response is to:,threaten consequences,deny termination,respect the client's right while discussing implications,disclose information to family,3,Clients have autonomy to terminate services.,Medium,Developmental Psychology,Chapter 1,Chapter 1 Set 1
Leaving test protocols unsecured violates:,social desirability,confidentiality and test security,interpretation norms,informed refusal,2,Secure handling of materials is required.,Medium,Developmental Psychology,Chapter 1,Chapter 1 Set 1
"Before conducting a court-ordered assessment, the practitioner should:",assume full confidentiality,"clarify role, purpose, and limits of confidentiality",promise secrecy,skip explanation,2,Third-party assessments require clear informed consent and role clarification. DEVELOPMENTAL PSYCHOLOGY EXAM 2,Medium,Developmental Psychology,Chapter 1,Chapter 1 Set 1
