Question,Choice 1,Choice 2,Choice 3,Choice 4,Correct Answer (1-4),Explanation,Difficulty,Subject,Chapter,Topic
"A client develops sudden blindness after witnessing a traumatic accident. Neurological examination does not support an organic cause, and the symptom is not intentionally produced. Which disorder is most consistent with this presentation-",Illness anxiety disorder,Factitious disorder,Conversion disorder,Somatic symptom disorder,3,"Conversion disorder involves genuinely experienced neurological-like symptoms, such as blindness or paralysis, that are not intentionally produced and are not supported by recognized neurological pathology.",Medium,Abnormal Psychology,Chapter 6: Chapter 6,Chapter 6
Which clinical presentation is most characteristic of conversion disorder-,Excessive fear of having a disease despite little or no somatic symptoms,Physical malfunctioning without corresponding physical pathology,Intentional symptom fabrication for financial gain,Chronic worry about appearance flaws,2,"Conversion disorder is classically characterized by physical dysfunction, often sensory or motor, that lacks corresponding recognized pathology and is not intentionally produced.",Medium,Abnormal Psychology,Chapter 6: Chapter 6,Chapter 6
Which factor most directly distinguishes malingering from factitious disorder-,Presence of dissociation,Severity of physical complaints,External incentive for symptom production,History of trauma,3,"Malingering is distinguished from factitious disorder by the presence of clear external reward, such as money, avoidance of duty, or legal advantage. Factitious disorder lacks such obvious external incentives.",Medium,Abnormal Psychology,Chapter 6: Chapter 6,Chapter 6
A man falsifies paralysis so he can obtain compensation after a workplace dispute. Which is the best classification-,Conversion disorder,Factitious disorder,Dissociative amnesia,Malingering,4,"The man is feigning symptoms for compensation, which is a clear external incentive. That pattern is most consistent with malingering.",Medium,Abnormal Psychology,Chapter 6: Chapter 6,Chapter 6
"A woman repeatedly induces symptoms and seeks hospital admission, but no clear external reward is evident. Which diagnosis is most appropriate-",Factitious disorder,Illness anxiety disorder,Somatic symptom disorder,Malingering,1,Factitious disorder involves intentional falsification or induction of symptoms in the absence of obvious external incentives. The goal is often to assume the sick role.,Medium,Abnormal Psychology,Chapter 6: Chapter 6,Chapter 6
"In conversion disorder, the physical symptom is best understood as:",Consciously faked and externally motivated,Consciously faked without external reward,"Genuinely experienced, though not explained by recognized pathology",Always caused by a neurological disease not yet detected,3,"In conversion disorder, symptoms are real to the patient and not intentionally feigned. The issue is incompatibility with recognized neurological or medical mechanisms.",Medium,Abnormal Psychology,Chapter 6: Chapter 6,Chapter 6
Which intervention has the strongest board-relevant support across somatic symptom and illness anxiety presentations-,Immediate confrontation and accusation of faking,"Cognitive-behavioral therapy aimed at reassurance, reducing stress, and minimizing maladaptive help-seeking",Long-term hospitalization for all cases,Exclusive use of dream analysis minimizing maladaptive help-seeking,2,"Board-relevant treatment principles for somatic symptom and illness anxiety presentations commonly include CBT, psychoeducation, reduction of stress, appropriate reassurance, and decreasing excessive help-seeking or reinforcement of sick-role behavior.",Medium,Abnormal Psychology,Chapter 6: Chapter 6,Chapter 6
A psychometrician in a hospital setting is asked to administer and score measures for a patient with excessive health worries. Which action is most consistent with RA 10029 and the PAP Code of Ethics-,Diagnose the disorder independently and prescribe management,Administer within competence and communicate results to the supervising psychologist or authorized referral source,Provide psychotherapy beyond training if the patient requests it,Disclose results to relatives without permission to reduce family worry psychologist or authorized referral source,2,"RA 10029 and the PAP Code require psychometricians to work within legal and professional boundaries, perform functions within competence, and coordinate appropriately with supervising or authorized professionals. Assessment functions are within role boundaries; independent diagnosis and prescription are not.",Medium,Abnormal Psychology,Chapter 6: Chapter 6,Chapter 6
A psychometrician is asked to explain to a client that test results suggest a somatic symptom-related presentation. Which response is most ethical-,"""Your symptoms are imaginary.""","""You are definitely pretending.""","""Your distress is real, and the results suggest that thoughts, feelings, and behaviors around symptoms may be contributing to the problem.""","""You have no right to question the findings."" behaviors around symptoms may be contributing to the problem.""",3,"This response is accurate, respectful, and non-stigmatizing. It validates suffering while explaining the clinical meaning of the findings. This is consistent with ethical communication and respect for dignity.",Medium,Abnormal Psychology,Chapter 6: Chapter 6,Chapter 6
Which statement best describes depersonalization-,Loss of memory for personal information,Sense of unreality or detachment from one's self,Adoption of a new identity during travel,Deliberate denial of one's illness,2,"Depersonalization refers to experiences of detachment from one's self, body, or mental processes, as if one were an outside observer.",Medium,Abnormal Psychology,Chapter 6: Chapter 6,Chapter 6
Which statement best describes derealization-,Feeling detached from one's surroundings as though the world is unreal,Forgetting one's entire life history,Faking neurological symptoms,Becoming convinced one has a severe illness,1,"Derealization refers to unreality or detachment from surroundings, such as feeling that the environment is dreamlike, foggy, or artificial.",Medium,Abnormal Psychology,Chapter 6: Chapter 6,Chapter 6
"A client says, ""I feel like I am outside my body watching myself, but I know this feeling is strange and not actually true."" Which diagnosis is most consistent with this report-",Psychotic disorder,Depersonalization-derealization disorder,Dissociative identity disorder,Illness anxiety disorder,2,The client reports classic depersonalization with preserved insight. Intact reality testing is a hallmark feature that helps distinguish this from psychotic disorders.,Medium,Abnormal Psychology,Chapter 6: Chapter 6,Chapter 6
Which feature is essential in distinguishing depersonalization-derealization disorder from psychotic disorders-,Presence of visual symptoms,History of trauma,Intact reality testing,Presence of panic attacks,3,A person with depersonalization-derealization disorder typically knows that the experience of unreality is subjective rather than literally true. This preserved insight distinguishes it from psychosis.,Medium,Abnormal Psychology,Chapter 6: Chapter 6,Chapter 6
Dissociative amnesia is best defined as:,Inability to remember new information because of dementia,Inability to recall autobiographical information inconsistent with ordinary forgetting,Deliberate refusal to report traumatic experiences,Global intellectual decline due to brain disease forgetting,2,"Dissociative amnesia is defined by inability to recall important autobiographical information, often trauma-related, beyond normal forgetting.",Medium,Abnormal Psychology,Chapter 6: Chapter 6,Chapter 6
"A survivor of a robbery cannot recall important details of the event and the surrounding hours, yet no neurological disorder is evident. Which diagnosis is most appropriate-",Dissociative amnesia,Depersonalization-derealization disorder,Factitious disorder,Somatic symptom disorder,1,"The client has trauma-related memory gaps without evidence of neurological disease, which is characteristic of dissociative amnesia.",Medium,Abnormal Psychology,Chapter 6: Chapter 6,Chapter 6
Which pattern is most characteristic of generalized dissociative amnesia-,Failure to learn new information after head trauma,Inability to remember one's identity and life history,Forgetting only one minor detail from a stressful day,Repeated intrusive illness fears,2,"Generalized dissociative amnesia is the broadest form and may involve inability to recall identity and life history, not merely a circumscribed event.",Medium,Abnormal Psychology,Chapter 6: Chapter 6,Chapter 6
Dissociative fugue refers to:,Temporary depersonalization during panic,Deliberate wandering to avoid responsibilities,Memory loss combined with unexpected travel,Motor paralysis without neurological basis,3,Dissociative fugue is a subtype of dissociative amnesia in which autobiographical memory disturbance occurs together with unexpected travel or wandering.,Medium,Abnormal Psychology,Chapter 6: Chapter 6,Chapter 6
Which statement best reflects the relationship between trauma and dissociative disorders-,Trauma is irrelevant to dissociation,Dissociative disorders are often associated with attempts to escape psychologically from overwhelming stress or traumatic memories,Only combat trauma is associated with dissociation,Dissociation occurs only in psychotic disorders psychologically from overwhelming stress or traumatic memories,2,A common conceptualization is that dissociation functions as a psychological escape from intolerable stress or traumatic memory material.,Medium,Abnormal Psychology,Chapter 6: Chapter 6,Chapter 6
Dissociative identity disorder is characterized primarily by:,Health anxiety with repeated reassurance seeking,Two or more distinct personality states with recurrent gaps in recall,Persistent fear of body deformity,Deliberate falsification of symptoms for attention,2,Dissociative identity disorder requires both identity disruption and recurrent amnesia inconsistent with ordinary forgetting.,Medium,Abnormal Psychology,Chapter 6: Chapter 6,Chapter 6
Which finding most strongly supports dissociative identity disorder rather than dissociative amnesia alone-,Autobiographical memory gap,Presence of pain complaints,Disruption of identity with distinct personality states,Panic during interviews,3,"Identity disruption is what separates DID from dissociative amnesia alone. Memory gaps may occur in both, but DID adds distinct personality states or marked discontinuity in self and agency.",Medium,Abnormal Psychology,Chapter 6: Chapter 6,Chapter 6
"A clinician notes abrupt shifts in voice, behavior, and autobiographical recall in a client, with recurrent ""lost time"" and no substance explanation. Which diagnosis is most likely-",Bipolar II disorder,Dissociative identity disorder,Illness anxiety disorder,Malingering,2,"Abrupt shifts in behavior, voice, and recall with lost time and no substance explanation strongly suggest DID.",Medium,Abnormal Psychology,Chapter 6: Chapter 6,Chapter 6
Which statement about dissociative identity disorder is most accurate-,It is diagnosed solely on the basis of dramatic alternate names and costumes,It requires recurrent gaps in recall inconsistent with ordinary forgetting,It is better explained by normal culturally accepted possession states,It excludes any history of trauma,2,Recurrent amnestic gaps are part of the formal diagnosis of DID and are essential alongside identity disruption.,Medium,Abnormal Psychology,Chapter 6: Chapter 6,Chapter 6
Which is a key treatment principle for dissociative disorders-,Encourage avoidance of all traumatic material indefinitely,Help the patient process traumatic experiences in a controlled therapeutic manner and build coping skills,Focus only on medication because psychotherapy worsens dissociation,Use confrontation to force immediate memory recovery manner and build coping skills,2,"A common treatment aim in dissociative disorders is careful, controlled processing of traumatic material while strengthening coping and stabilization.",Medium,Abnormal Psychology,Chapter 6: Chapter 6,Chapter 6
"In working with dissociative identity disorder, which therapeutic factor is especially important-",Strict behavioral punishment,Rapid interpretation of every symptom,A stable sense of trust between therapist and patient,Avoidance of all discussion of identity states,3,"Trust is especially important in DID because treatment is often long-term, trauma-related, and requires careful work with fragmented experience and vulnerability.",Medium,Abnormal Psychology,Chapter 6: Chapter 6,Chapter 6
A psychometrician is handling records of a client with dissociative symptoms. Which action is most ethical-,Share the records with classmates for consultation,Keep information confidential and disclose only with proper consent or lawful/authorized basis,Post anonymized details online without permission because the case is educational,Release results to the employer upon verbal request lawful/authorized basis,2,"Confidentiality is a core ethical obligation under the PAP Code. Sensitive assessment data, particularly in dissociative cases, must be protected and disclosed only on proper ethical or legal grounds.",Medium,Abnormal Psychology,Chapter 6: Chapter 6,Chapter 6
A psychometrician is asked to perform psychotherapy for a client with dissociative identity disorder because the psychologist is unavailable. Which response is most appropriate under RA 10029 and the PAP Code of Ethics-,Accept immediately because any mental health worker may do therapy,Decline and refer to or work under the appropriate licensed professional within lawful boundaries of competence,Proceed if the client signs a waiver,Offer treatment as long as no fee is charged lawful boundaries of competence,2,RA 10029 and the PAP Code require psychology practitioners to stay within scope and competence. A psychometrician should not independently assume psychotherapy duties beyond lawful and professional role boundaries.,Medium,Abnormal Psychology,Chapter 6: Chapter 6,Chapter 6
Which presentation best differentiates illness anxiety disorder from factitious disorder-,"Illness anxiety disorder involves genuine fear of illness, whereas factitious disorder involves intentional falsification","Illness anxiety disorder always has neurological deficits, whereas factitious disorder does not",Factitious disorder always has obvious financial reward,Illness anxiety disorder requires memory loss disorder involves intentional falsification,1,Illness anxiety disorder is characterized by sincere illness fear; factitious disorder involves conscious falsification or induction of symptoms.,Medium,Abnormal Psychology,Chapter 6: Chapter 6,Chapter 6
A patient with nonepileptic seizure-like episodes also reports dissociative symptoms. Which statement is most accurate-,Functional neurological symptom disorder and a dissociative disorder cannot be diagnosed together,Dissociative symptoms rule out functional neurological symptom disorder,Both diagnoses may be made when criteria for each are met,Such symptoms are always malingering,3,"Functional neurological symptom disorder and dissociative disorders may coexist. If the patient meets criteria for both, both diagnoses can be made.",Medium,Abnormal Psychology,Chapter 6: Chapter 6,Chapter 6
"A client with depersonalization symptoms says, ""I know the world has not actually changed, but it feels unreal."" This statement most directly indicates:",Delusional conviction,Intact reality testing,Generalized amnesia,Factitious presentation,2,"The client recognizes that the environment has not literally changed, showing preserved reality testing, which supports depersonalization-derealization disorder rather than psychosis.",Medium,Abnormal Psychology,Chapter 6: Chapter 6,Chapter 6
Which client is the best example of somatic symptom disorder rather than illness anxiety disorder-,A client with almost no bodily symptoms but persistent fear of having cancer,"A client with multiple distressing bodily complaints and excessive worry, time, and energy devoted to them",A client who intentionally induces fever to assume the sick role,A client who suddenly travels away and forgets personal history and energy devoted to them,2,Somatic symptom disorder is centered on substantial somatic symptoms plus disproportionate preoccupation and behavioral investment in them.,Medium,Abnormal Psychology,Chapter 6: Chapter 6,Chapter 6
"In a culturally sanctioned religious ritual, a participant briefly enters a trance-like state without distress, dysfunction, or violation of cultural norms. Which is the best conclusion-",Dissociative identity disorder should automatically be diagnosed,Conversion disorder is most likely,A mental disorder diagnosis is not made solely on the basis of this culturally normative behavior,Factitious disorder is most likely normative behavior,3,"Culturally sanctioned trance or possession states that are normative, non-distressing, and non-impairing are not diagnosed as mental disorders. Cultural context must be considered in assessment.",Medium,Abnormal Psychology,Chapter 6: Chapter 6,Chapter 6
Which statement best distinguishes normal sadness from a major depressive episode-,"Normal sadness always follows a stressful event, whereas major depression does not","Major depression necessarily includes psychosis, whereas normal sadness does not",Major depression involves a clinically significant syndrome of symptoms with distress or impairment,"Normal sadness is always brief, whereas major depression always lasts for years distress or impairment",3,"Major depressive disorder is distinguished from ordinary sadness by the presence of a clinically significant syndrome that causes distress or impairment. It is not defined simply by feeling sad after stress, but by a pattern of symptoms that reflects dysfunction and has clinical significance.",Medium,Abnormal Psychology,Chapter 7: Chapter 7,Chapter 7
"A client reports depressed mood for most of the day nearly every day for the last 3 weeks, with insomnia, fatigue, diminished concentration, feelings of worthlessness, and recurrent thoughts of death. Which diagnosis is most strongly supported-",Persistent depressive disorder,Major depressive episode,Cyclothymic disorder,Adjustment disorder,2,The client has depressed mood for at least 2 weeks plus enough associated symptoms to meet threshold for a major depressive episode. This is the syndromal depressive episode required for major depressive disorder and can also occur in bipolar disorders.,Medium,Abnormal Psychology,Chapter 7: Chapter 7,Chapter 7
Which symptom pair best captures the core emotional poles of mood disorders-,Obsessions and compulsions,Delusions and hallucinations,Depression and mania,Dissociation and somatization,3,"Mood disorders are organized around disturbances in mood polarity, especially depression and mania, with hypomania as a related but less severe elevated state.",Medium,Abnormal Psychology,Chapter 7: Chapter 7,Chapter 7
Which feature is most characteristic of mania rather than hypomania-,Elevated mood lasting at least 2 days,"Marked impairment, hospitalization, or psychotic features",Increased energy without change in functioning,Mild distractibility with intact judgment,2,"A manic episode is distinguished from hypomania by severity. Mania causes marked impairment, may require hospitalization, or includes psychotic features. Hypomania does not include psychosis by definition and is not markedly impairing.",Medium,Abnormal Psychology,Chapter 7: Chapter 7,Chapter 7
"A person has had at least one major depressive episode and at least one hypomanic episode, but no history of mania. Which diagnosis is most appropriate-",Bipolar I disorder,Cyclothymic disorder,Bipolar II disorder,Persistent depressive disorder,3,"Bipolar II disorder requires at least one major depressive episode and at least one hypomanic episode, with no history of mania.",Medium,Abnormal Psychology,Chapter 7: Chapter 7,Chapter 7
Which finding would immediately rule out bipolar II disorder-,Recurrent depressive episodes,Presence of anxiety symptoms,A past manic episode,A family history of bipolar disorder,3,Any past manic episode excludes bipolar II disorder and changes the diagnosis to bipolar I disorder.,Medium,Abnormal Psychology,Chapter 7: Chapter 7,Chapter 7
Which statement best describes hypomania-,It is always severe enough to require hospitalization,It includes psychotic symptoms by definition,"It is a distinct period of elevated, expansive, or irritable mood with increased activity or energy that is not markedly impairing",It is identical to normal happiness activity or energy that is not markedly impairing,3,"Hypomania involves a noticeable change in mood and energy lasting at least 4 days without marked impairment, hospitalization, or psychosis.",Medium,Abnormal Psychology,Chapter 7: Chapter 7,Chapter 7
"A client presents with repeated periods of elevated energy, reduced need for sleep, grandiosity, and risky spending that caused severe occupational disruption and required admission to a hospital. Which diagnosis is most likely-",Bipolar I disorder,Bipolar II disorder,Cyclothymic disorder,Major depressive disorder with mixed features,1,"Severe elevated mood symptoms with marked disruption and hospitalization indicate a manic episode, which is sufficient for bipolar I disorder.",Medium,Abnormal Psychology,Chapter 7: Chapter 7,Chapter 7
Which diagnosis is characterized by numerous periods of hypomanic symptoms and numerous periods of depressive symptoms that do not meet full criteria for hypomanic or major depressive episodes-,Bipolar I disorder,Cyclothymic disorder,Persistent depressive disorder,Major depressive disorder,2,Cyclothymic disorder involves chronic fluctuations of hypomanic and depressive symptoms that never meet full episode criteria.,Medium,Abnormal Psychology,Chapter 7: Chapter 7,Chapter 7
Which statement about bipolar II disorder is most accurate-,It is simply a mild form of bipolar I disorder,It is often associated with substantial burden from depression and functional impairment,It cannot recur after the first episode,It is diagnosed only when psychotic symptoms are present impairment,2,"Bipolar II disorder is not merely a mild form of bipolar I. Although hypomania is less severe than mania, depressive burden and chronic functional impairment can be substantial.",Medium,Abnormal Psychology,Chapter 7: Chapter 7,Chapter 7
"A depressed client also shows elevated mood, increased talkativeness, decreased need for sleep, and racing thoughts during the depressive episode. Which specifier is most appropriate-",With melancholic features,With anxious distress,With mixed features,With catatonia,3,"When a major depressive episode includes at least three manic or hypomanic symptoms during most days, the appropriate specifier is with mixed features.",Medium,Abnormal Psychology,Chapter 7: Chapter 7,Chapter 7
Which specifier is used when at least four mood episodes occur within 12 months-,With seasonal pattern,With rapid cycling,With peripartum onset,With mood-congruent psychotic features,2,Rapid cycling is specified when four or more qualifying mood episodes occur within a 12-month period.,Medium,Abnormal Psychology,Chapter 7: Chapter 7,Chapter 7
Which clinical clue most strongly suggests that a person diagnosed with major depressive disorder should be further assessed for bipolarity-,Presence of guilt and low mood,Recurrent appetite loss,Past periods of decreased need for sleep and increased goal-directed activity,Stress preceding the depressive episode,3,A history suggestive of hypomania or mania is the strongest clue that apparent unipolar depression may actually fall within the bipolar spectrum.,Medium,Abnormal Psychology,Chapter 7: Chapter 7,Chapter 7
Which statement best differentiates bipolar I disorder from major depressive disorder-,Bipolar I disorder includes at least one manic episode,Major depressive disorder includes only mild symptoms,Bipolar I disorder never includes depression,Major depressive disorder always begins later in life,1,The presence of a manic episode is the defining feature that separates bipolar I disorder from major depressive disorder.,Medium,Abnormal Psychology,Chapter 7: Chapter 7,Chapter 7
Which description best fits persistent depressive disorder-,Depressed mood lasting at least 2 weeks with psychotic features,Chronic depressed mood for most days over at least 2 years,Alternating mania and major depression over 1 month,Depression caused exclusively by bereavement,2,"Persistent depressive disorder is a chronic depressive condition marked by depressed mood for most of the day, more days than not, for at least 2 years in adults.",Medium,Abnormal Psychology,Chapter 7: Chapter 7,Chapter 7
"A client has chronic depressed mood for over 2 years, low energy, poor self-esteem, and hopelessness, but no history of hypomania or mania. Which diagnosis is most likely-",Persistent depressive disorder,Bipolar II disorder,Cyclothymic disorder,Brief psychotic disorder,1,"The long-standing depressed mood and associated symptoms over more than 2 years, without hypomania or mania, are most consistent with persistent depressive disorder.",Medium,Abnormal Psychology,Chapter 7: Chapter 7,Chapter 7
Which symptom is more typical of a manic episode than of a major depressive episode-,Psychomotor retardation,Excessive guilt,Flight of ideas,Anhedonia,3,Flight of ideas is a classic manic symptom reflecting accelerated thought processes and is not a defining depressive symptom.,Medium,Abnormal Psychology,Chapter 7: Chapter 7,Chapter 7
