Question,Choice 1,Choice 2,Choice 3,Choice 4,Correct Answer (1-4),Explanation,Difficulty,Subject,Chapter,Topic
Which statement best reflects the Chapter 1 definition of a psychological disorder- impairment and not merely a culturally expected response),Any unusual behavior is abnormal if it differs from the majority,A psychological disorder is a psychological dysfunction associated with distress or impairment and not merely a culturally expected response,A psychological disorder is any behavior caused by biological abnormality,A psychological disorder is any severe emotional reaction to stress,2,"This definition reflects the key components of psychological disorder: dysfunction, distress or impairment, and deviation from cultural expectations.",Medium,Abnormal Psychology,Chapter 1: Chapter 1,Chapter 1
"A student becomes intensely distressed after failing one quiz and says, ""Since I feel bad, I must have a psychological disorder."" Which response is most accurate- (Answer: C. Incorrect, because diagnosis requires more than distress alone)","Correct, because distress alone is sufficient for diagnosis","Correct, because all intense emotions indicate abnormality","Incorrect, because diagnosis requires more than distress alone","Incorrect, because only biological symptoms qualify",3,"Distress alone is not sufficient for diagnosis; multiple criteria must be considered, including impairment and cultural context.",Medium,Abnormal Psychology,Chapter 1: Chapter 1,Chapter 1
Which of the following most clearly illustrates the scientist-practitioner model-,Using only one favored theory for all clients,Depending on intuition rather than evidence,Applying research findings while systematically evaluating one's own clinical work,Avoiding diagnosis because labels are stigmatizing,3,The scientist-practitioner model integrates research with clinical practice and ongoing evaluation.,Medium,Abnormal Psychology,Chapter 1: Chapter 1,Chapter 1
Which question is most consistent with the clinical description component of psychopathology- have they lasted-),What neurotransmitter is involved-,"What symptoms are present, how severe are they, and how long have they lasted-",Which treatment is cheapest-,What legal issue may arise-,2,"Clinical description focuses on identifying symptoms, severity, duration, and associated features.",Medium,Abnormal Psychology,Chapter 1: Chapter 1,Chapter 1
"In psychopathology research, etiology refers to: contributing factors of a disorder)",The legal status of a disorder,The expected treatment outcome,The causes or contributing factors of a disorder,The rate of relapse after treatment,3,Etiology specifically refers to the origins or causes of a disorder.,Medium,Abnormal Psychology,Chapter 1: Chapter 1,Chapter 1
Prevalence refers to: given time),The number of new cases during a given period,The total number of cases in a population at a given time,The probability of recovery after treatment,The number of symptoms required for diagnosis,2,Prevalence measures all existing cases in a population at a specific point in time.,Medium,Abnormal Psychology,Chapter 1: Chapter 1,Chapter 1
Incidence refers to: specified period),The number of existing and new cases combined,The seriousness of impairment,The number of new cases occurring during a specified period,The duration of the disorder,3,Incidence counts only new cases that develop within a certain time frame.,Medium,Abnormal Psychology,Chapter 1: Chapter 1,Chapter 1
Which statement best captures the supernatural tradition in abnormal behavior-,Abnormal behavior results from disturbed neurotransmitters only,Abnormal behavior is best explained by learning history alone,"Abnormal behavior may reflect the action of demons, spirits, or cosmic forces",Abnormal behavior is always a moral weakness,3,The supernatural tradition attributes abnormal behavior to external spiritual or mystical forces.,Medium,Abnormal Psychology,Chapter 1: Chapter 1,Chapter 1
A community attributes bizarre behavior to spirit possession and seeks ritual expulsion of the spirit. This most clearly reflects:,Behavioral tradition,Humanistic tradition,Supernatural tradition,Biological tradition,3,Spirit possession and exorcism are hallmark features of supernatural explanations.,Medium,Abnormal Psychology,Chapter 1: Chapter 1,Chapter 1
Which historical figure is most associated with the early biological tradition-,Freud,Hippocrates,Mesmer,Rogers,2,Hippocrates proposed that abnormal behavior results from physical imbalances in the body.,Medium,Abnormal Psychology,Chapter 1: Chapter 1,Chapter 1
The early biological tradition is best represented by the view that abnormal behavior:,Originates mainly from unconscious conflict,Is due to physical illness or internal bodily dysfunction,Is always chosen voluntarily,Should be treated by confession and exorcism,2,The biological model views abnormal behavior as stemming from physiological or medical causes.,Medium,Abnormal Psychology,Chapter 1: Chapter 1,Chapter 1
Which statement about the psychological tradition is most accurate- explains abnormal behavior in terms of psychological development and experience),It rejects social influences entirely,It explains abnormal behavior in terms of psychological development and experience,It assumes all disorders are inherited,It is identical to the biological model,2,"The psychological tradition focuses on internal mental processes, development, and experience.",Medium,Abnormal Psychology,Chapter 1: Chapter 1,Chapter 1
Moral therapy was based primarily on the idea that many patients improve when treated with:,"Fear, punishment, and seclusion","Kindness, structure, and humane care",Strict medication alone,Religious coercion,2,Moral therapy emphasized humane and respectful treatment conditions.,Medium,Abnormal Psychology,Chapter 1: Chapter 1,Chapter 1
"Which situation best illustrates the spirit of moral therapy- rest, predictable routines, respectful interaction, and purposeful activity)",Chaining disturbed patients to prevent movement,"Providing rest, predictable routines, respectful interaction, and purposeful activity",Encouraging public humiliation to build insight,Using aversive stimulation for all symptoms,2,"Moral therapy involves structured, humane, and supportive environments.",Medium,Abnormal Psychology,Chapter 1: Chapter 1,Chapter 1
One major reason for the decline of moral therapy was: numbers of patients and limited resources made individualized humane care difficult),It was shown to worsen all disorders,Large numbers of patients and limited resources made individualized humane care difficult,Freud prohibited its use,It was replaced immediately by community care,2,Overcrowding and lack of resources made moral therapy difficult to sustain. Continuing with the same format:,Medium,Abnormal Psychology,Chapter 1: Chapter 1,Chapter 1
"According to psychoanalytic theory, the unconscious refers to: processes outside awareness that can influence behavior)",Intentional lying by the client,Mental processes outside awareness that can influence behavior,A purely neurological reflex,Behavior learned through reinforcement,2,"The unconscious includes thoughts, memories, and desires outside awareness that influence behavior.",Medium,Abnormal Psychology,Chapter 1: Chapter 1,Chapter 1
"In classical psychoanalytic theory, the component that operates on the pleasure principle is the:",Ego,Superego,Id,Self-concept,3,The id seeks immediate gratification and operates according to the pleasure principle.,Medium,Abnormal Psychology,Chapter 1: Chapter 1,Chapter 1
"In psychoanalytic theory, the component most directly involved in mediating between instinctual demands, moral standards, and reality is the:",Id,Ego,Superego,Collective unconscious,2,"The ego balances the demands of the id, superego, and reality.",Medium,Abnormal Psychology,Chapter 1: Chapter 1,Chapter 1
"When a client attributes feelings originally directed toward a parent to the therapist, this is called:",Catharsis,Transference,Free association,Fixation,2,Transference involves redirecting emotions from past relationships onto the therapist.,Medium,Abnormal Psychology,Chapter 1: Chapter 1,Chapter 1
Which intervention is most characteristic of traditional psychoanalysis- (Answer: B. Free association),Systematic desensitization,Free association,Token economy,Modeling,2,Free association allows access to unconscious material in psychoanalysis.,Medium,Abnormal Psychology,Chapter 1: Chapter 1,Chapter 1
Humanistic theorists emphasized: self-actualization),Determinism and unconscious drives alone,"Growth, personal meaning, and self-actualization",Possession and spiritual warfare,The exclusive role of heredity,2,Humanistic psychology focuses on personal growth and achieving one's potential.,Medium,Abnormal Psychology,Chapter 1: Chapter 1,Chapter 1
Which statement best represents the behavioral model- behavior is learned and can therefore be modified through learning principles),Symptoms result mainly from hidden psychic conflict,Maladaptive behavior is learned and can therefore be modified through learning principles,Mental illness is caused only by humoral imbalance,Diagnosis should ignore observable behavior,2,The behavioral model explains behavior as learned and modifiable.,Medium,Abnormal Psychology,Chapter 1: Chapter 1,Chapter 1
A client's fear decreases after gradual exposure to the feared object while remaining relaxed. This approach is rooted most strongly in the behavioral model. (Answer: B. Behavioral model),Psychoanalytic model,Behavioral model,Supernatural model,Humanistic model,2,Exposure and relaxation are behavioral techniques based on conditioning.,Medium,Abnormal Psychology,Chapter 1: Chapter 1,Chapter 1
Which of the following is most consistent with the integrative approach described in the text- psychopathology),One cause is always sufficient to explain a disorder,"Biological, psychological, and social factors interact in producing psychopathology",Social factors are secondary and usually irrelevant,"Diagnosis should be based only on symptoms, not causes",2,The integrative approach emphasizes multiple interacting factors.,Medium,Abnormal Psychology,Chapter 1: Chapter 1,Chapter 1
Which statement is most consistent with the current scientific view in Chapter 1- one-dimensional models),Abnormal behavior should be explained by a single tradition whenever possible,Modern psychopathology favors multidimensional explanations over one-dimensional models,Psychological disorders are best understood without research,Historical models are no longer useful to study,2,Modern approaches emphasize multidimensional and evidence-based explanations.,Medium,Abnormal Psychology,Chapter 1: Chapter 1,Chapter 1
"A clinician says, ""I will diagnose this case only after considering description, possible causes, and evidence-based treatment implications."" This approach most closely reflects:",Exorcistic reasoning,Scientist-practitioner thinking,Lay diagnosis,Magical thinking,2,This reflects a systematic and evidence-based approach to clinical work.,Medium,Abnormal Psychology,Chapter 1: Chapter 1,Chapter 1
Which statement best differentiates a phobia from ordinary fear- phobia involves fear that is disproportionate and interferes with functioning),A phobia is always biologically caused,A phobia involves fear that is disproportionate and interferes with functioning,A phobia occurs only in childhood,A phobia is culturally universal in all forms,2,Phobias are excessive fears that impair daily functioning.,Medium,Abnormal Psychology,Chapter 1: Chapter 1,Chapter 1
Why is cultural context important in identifying abnormal behavior- (Answer: B. Because behavior that appears unusual may still be culturally expected or acceptable),Because culture determines all diagnosis,Because behavior that appears unusual may still be culturally expected or acceptable,Because only non-Western cultures shape symptoms,Because diagnosis should never consider culture,2,Cultural norms influence whether behavior is considered abnormal.,Medium,Abnormal Psychology,Chapter 1: Chapter 1,Chapter 1
"A person hears voices after prolonged sleep deprivation, stimulant use, and severe stress. A careful examiner avoids immediate labeling and instead evaluates several contributing factors. This most strongly reflects: mindset in psychopathology)",The weakness of diagnosis,The integrative and differential mindset in psychopathology,The superiority of supernatural explanations,The irrelevance of assessment,2,This demonstrates careful consideration of multiple possible causes.,Medium,Abnormal Psychology,Chapter 1: Chapter 1,Chapter 1
Which historical trend is most closely linked to the movement away from supernatural explanations and toward naturalistic accounts- biological and psychological models),Increased use of astrology,Development of biological and psychological models,Rejection of observation,Abandonment of treatment,2,Scientific and psychological models replaced supernatural explanations.,Medium,Abnormal Psychology,Chapter 1: Chapter 1,Chapter 1
"Under RA 10029 and the PAP Code, which activity is most appropriate for a psychometrician- competence and within legal limits)",Independently conducting psychotherapy for severe trauma,Administering and scoring appropriate psychological tests within competence and within legal limits,Diagnosing all mental disorders without supervision,Using projective tests regardless of training,2,Psychometricians must operate within their scope and competence.,Medium,Abnormal Psychology,Chapter 1: Chapter 1,Chapter 1
"A psychometrician is asked to interpret complex personality findings and issue a final clinical formulation without supervision. What is the best response- refer, because work must remain within competence and legal/professional limits)","Accept, because experience alone is enough","Accept, if the client agrees","Decline or refer, because work must remain within competence and legal/professional limits",Proceed if no written report is made,3,Ethical practice requires staying within professional limits and seeking supervision when needed.,Medium,Abnormal Psychology,Chapter 1: Chapter 1,Chapter 1
Which ethical principle is most directly involved when protecting a client's raw test data and personal information-,Beneficence only,Confidentiality and privacy,Justice only,Fidelity only,2,Confidentiality ensures protection of client information.,Medium,Abnormal Psychology,Chapter 1: Chapter 1,Chapter 1
"A psychometrician uses an outdated test with weak norms for the client's population because it is cheaper and easier. This is: assessment tools should be valid, reliable, appropriate, and not obsolete)",Acceptable if the client signs consent,Ethical if the results are kept confidential,"Unethical because assessment tools should be valid, reliable, appropriate, and not obsolete",Acceptable for screening only,3,Ethical standards require use of valid and current assessment tools.,Medium,Abnormal Psychology,Chapter 1: Chapter 1,Chapter 1
"A school requests a student's test results. According to ethical standards, the best practice is to: with appropriate permission and explanation)",Send the full raw data immediately to all teachers,"Release results only to proper referral sources or authorized parties, with appropriate permission and explanation",Refuse to explain the results to anyone,Post a summary in the faculty group chat,2,Results must be shared only with authorized individuals and handled responsibly.,Medium,Abnormal Psychology,Chapter 1: Chapter 1,Chapter 1
"A psychometrician delegates testing to an untrained assistant because the clinic is busy. Under the PAP Code, this is problematic mainly because: delegated only to persons competent to perform them with appropriate supervision)",Delegation is always prohibited,Tasks may be delegated only to persons competent to perform them with appropriate supervision,Clients do not need to know who gives the test,Speed is less important than profit,2,Delegation must ensure competence and supervision.,Medium,Abnormal Psychology,Chapter 1: Chapter 1,Chapter 1
"During teleassessment, a client has unstable internet connection during a timed test. Ethically, the psychometrician should primarily: impact on performance and manage the situation appropriately)",Ignore the issue because the session already started,Note that teleassessment is never allowed,Inform the client of the likely impact on performance and manage the situation appropriately,Automatically fail the client,3,Ethical practice requires addressing threats to test validity and informing the client.,Medium,Abnormal Psychology,Chapter 1: Chapter 1,Chapter 1
"Which action best reflects ethical boundaries of competence- training, supervision, consultation, or referral when a case exceeds one's competence)",Continuing a service one is unprepared to perform because referral is inconvenient,Studying new methods only after a complaint is filed,"Seeking training, supervision, consultation, or referral when a case exceeds one's competence",Accepting all referrals to gain experience quickly,3,Professionals must remain within their competence and seek help when necessary.,Medium,Abnormal Psychology,Chapter 1: Chapter 1,Chapter 1
"A psychometrician becomes aware that personal stress is significantly affecting concentration during assessment work. The most ethical response is to: appropriate measures such as consultation, limiting duties, or temporary suspension of affected work)",Continue working and hope accuracy is unaffected,"Take appropriate measures such as consultation, limiting duties, or temporary suspension of affected work",Hide the problem to protect reputation,Shift responsibility to the client,2,Ethical standards require managing personal issues that may impair professional performance.,Medium,Abnormal Psychology,Chapter 1: Chapter 1,Chapter 1
"Which scenario best reflects both Chapter 1's integrative approach and Philippine ethical practice- biological-psychological-social factors, and protecting confidentiality)",Explaining all abnormal behavior solely through demonic possession,"Conducting assessment using valid tools, considering biological-psychological-social factors, and protecting confidentiality",Making conclusions from one interview only because experience is sufficient,Releasing test scores to anyone who asks if they seem concerned,2,This reflects both multidimensional understanding and ethical practice.,Medium,Abnormal Psychology,Chapter 1: Chapter 1,Chapter 1
Which statement best reflects a multidimensional integrative approach to psychopathology-,Mental disorders are caused primarily by unconscious conflict.,"Mental disorders result from the interaction of biological, psychological, and social influences.",Mental disorders are best explained only by neurotransmitter abnormalities.,Mental disorders are largely the product of moral weakness. social influences.,2,"The integrative approach emphasizes that psychopathology is best understood through interacting biological, psychological, and social factors rather than a single-cause model.",Medium,Abnormal Psychology,Chapter 2: Chapter 2,Chapter 2
A clinician explains that a person's panic symptoms emerged only after a major stressor activated a preexisting vulnerability. Which model is best illustrated-,Classical conditioning model,Diathesis-stress model,Humanistic model,Moral model,2,"The diathesis-stress model proposes that an inherited or acquired vulnerability may remain latent until activated by a stressor, leading to disorder.",Medium,Abnormal Psychology,Chapter 2: Chapter 2,Chapter 2
Which statement best describes polygenic influence-,A single gene completely determines one psychological disorder.,Several unrelated environments replace genetic influence.,Many genes contribute small effects to behavioral and psychological traits.,"Genes affect only physical, not psychological, characteristics.",3,"Polygenic influence means complex traits, including many forms of psychopathology, are shaped by multiple genes with small individual effects.",Medium,Abnormal Psychology,Chapter 2: Chapter 2,Chapter 2
"A child with a genetic vulnerability for conduct problems also tends to evoke harsh reactions from others, increasing exposure to stress that strengthens the problem. This is best described as:",Extinction,Reciprocal gene-environment correlation,Negative reinforcement,Circular reasoning,2,This model describes how genetic tendencies may increase exposure to environmental experiences that then reinforce the disorder process.,Medium,Abnormal Psychology,Chapter 2: Chapter 2,Chapter 2
Which statement best describes epigenetics-,Permanent alteration of DNA sequence by psychotherapy,Environmental effects on whether certain genes are expressed,Inheritance of disorders through one dominant gene only,Elimination of biological influences by social learning,2,Epigenetics concerns how environmental influences such as stress may switch genes on or off without changing the DNA sequence itself.,Medium,Abnormal Psychology,Chapter 2: Chapter 2,Chapter 2
Which conclusion is most consistent with contemporary views of genetic contributions to psychopathology-,Genetic vulnerability guarantees later disorder.,Environment is irrelevant when heritability is high.,Genetic and environmental influences interact in complex ways.,Psychological disorders are inherited in exactly the same way as eye color.,3,Contemporary psychopathology rejects strict nature-versus-nurture thinking and instead emphasizes interaction between vulnerability and experience.,Medium,Abnormal Psychology,Chapter 2: Chapter 2,Chapter 2
Which nervous system division is primarily responsible for coordinating basic bodily functions and transmitting information within the brain and spinal cord-,Peripheral nervous system,Somatic nervous system,Central nervous system,Autonomic nervous system,3,The central nervous system consists of the brain and spinal cord and coordinates fundamental processing relevant to behavior and psychopathology.,Medium,Abnormal Psychology,Chapter 2: Chapter 2,Chapter 2
Which neurotransmitter has most often been linked to mood regulation and has been prominently implicated in depression and related emotional disorders-,Serotonin,Acetylcholine,Endorphin,Histamine,1,Serotonin is strongly associated with mood regulation and has been widely studied in depression and emotional disorders.,Medium,Abnormal Psychology,Chapter 2: Chapter 2,Chapter 2
Gamma-aminobutyric acid (GABA) is best described as a neurotransmitter that is primarily:,Excitatory and increases overall neural firing,Inhibitory and helps regulate excessive neural activity,Responsible only for motor movement,Unrelated to anxiety and mood processes,2,GABA is the major inhibitory neurotransmitter and is especially important in regulating anxiety and arousal.,Medium,Abnormal Psychology,Chapter 2: Chapter 2,Chapter 2
Dopamine dysfunction has been most strongly associated with which clinical phenomenon-,Specific phobia,Psychotic symptoms such as delusions and hallucinations,Dissociative fugue only,Somatic symptom disorder only,2,"Dopamine dysregulation has long been associated with psychotic symptoms, especially in schizophrenia spectrum disorders.",Medium,Abnormal Psychology,Chapter 2: Chapter 2,Chapter 2
Which statement best captures the role of brain circuits in psychopathology-,One isolated brain area fully explains each mental disorder.,Psychological disorders often involve dysregulation in interconnected neural pathways.,Brain circuits matter only in neurocognitive disorders.,Brain circuits are clinically irrelevant because behavior is learned. pathways.,2,Modern neuroscience emphasizes circuits and networks rather than single isolated regions as the basis for many disorders.,Medium,Abnormal Psychology,Chapter 2: Chapter 2,Chapter 2
A researcher finds that early caregiving experiences influence later stress regulation and emotional responding through effects on brain development. This finding most strongly supports:,A purely biological model,Psychosocial effects on brain structure and function,The view that childhood has little role in later psychopathology,The conclusion that genes are unimportant,2,Early experiences can shape later stress reactivity and emotional function by influencing the developing brain.,Medium,Abnormal Psychology,Chapter 2: Chapter 2,Chapter 2
Which learning principle is best illustrated when a person develops intense fear after pairing a previously neutral stimulus with a traumatic experience-,Operant extinction,Classical conditioning,Modeling,Latent learning,2,"When a neutral stimulus becomes associated with trauma and later elicits fear, classical conditioning is involved.",Medium,Abnormal Psychology,Chapter 2: Chapter 2,Chapter 2
A student starts avoiding class presentations after observing a classmate being ridiculed during one. Which concept is best illustrated-,Insight learning,Social learning or modeling,Reciprocal inhibition,Response prevention,2,"The student acquires fear by observing another person's negative experience, which is characteristic of modeling.",Medium,Abnormal Psychology,Chapter 2: Chapter 2,Chapter 2
Learned helplessness is most closely associated with:,Increased belief that outcomes can be controlled,Passive behavior following repeated experiences of uncontrollable events,Fear acquired only through direct trauma,Improved resilience after failure,2,"Learned helplessness develops when repeated uncontrollable experiences produce passivity, hopelessness, and reduced attempts to cope.",Medium,Abnormal Psychology,Chapter 2: Chapter 2,Chapter 2
