Question,Choice 1,Choice 2,Choice 3,Choice 4,Correct Answer (1-4),Explanation,Difficulty,Subject,Chapter,Topic
Which of the following best reflects a dimensional perspective on personality pathology-,Personality disorders are totally unrelated to normal personality traits,Personality disorders are maladaptive variants of personality traits that exist on a continuum,Only one personality disorder can be present at a time,Dimensional models eliminate the need for clinical judgment on a continuum,2,A dimensional model views personality pathology as extreme or maladaptive trait variants that blend into normal personality and into one another along continua.,Medium,Abnormal Psychology,Chapter 12: Chapter 12,Chapter 12
"A client has long-standing suspiciousness, aloofness, odd beliefs, and social anxiety. Which differential point most strongly favors schizotypal personality disorder over paranoid personality disorder-",Presence of magical thinking and unusual perceptual experiences,Tendency to hold grudges,Reluctance to confide in others,Misreading neutral remarks as threatening,1,Schizotypal personality disorder is favored when suspiciousness and social isolation are accompanied by magical thinking or unusual perceptual experiences.,Medium,Abnormal Psychology,Chapter 12: Chapter 12,Chapter 12
Which of the following is a required feature for a diagnosis of schizophrenia-,At least one manic episode,At least one month of active-phase symptoms within a disturbance lasting at least six months,Delusions occurring without any other psychotic symptoms,Full return to premorbid functioning within one month least six months,2,"Schizophrenia requires continuous signs of disturbance for at least 6 months, including at least 1 month of active-phase symptoms such as delusions, hallucinations, disorganized speech, grossly disorganized or catatonic behavior, or negative symptoms. This is the core duration framework for schizophrenia.",Medium,Abnormal Psychology,Chapter 13: Chapter 13,Chapter 13
Which symptom is classified as a negative symptom of schizophrenia-,Delusion,Hallucination,Avolition,Flight of ideas,3,Avolition is a negative symptom involving decreased motivation and reduced self-initiated purposeful behavior. It is one of the most prominent negative symptoms in schizophrenia.,Medium,Abnormal Psychology,Chapter 13: Chapter 13,Chapter 13
"A client presents with delusions, hallucinations, and disorganized speech for 3 months. There is no clear evidence yet of a six-month total duration. Which diagnosis is most consistent with the presentation-",Brief Psychotic Disorder,Schizophreniform Disorder,Schizoaffective Disorder,Delusional Disorder,2,"Schizophreniform disorder has the same symptomatic presentation as schizophrenia, but its duration is at least 1 month and less than 6 months. A 3-month duration fits this range.",Medium,Abnormal Psychology,Chapter 13: Chapter 13,Chapter 13
Which feature best distinguishes delusional disorder from schizophrenia-,Presence of psychosis,Presence of mood symptoms,Absence of the other characteristic active-phase symptoms of schizophrenia,Onset in adulthood,3,"Delusional disorder is distinguished by persistent delusions without the other characteristic active-phase symptoms of schizophrenia, such as prominent hallucinations, disorganized speech, grossly disorganized or catatonic behavior, and negative symptoms.",Medium,Abnormal Psychology,Chapter 13: Chapter 13,Chapter 13
"A person has psychotic symptoms lasting 10 days, then returns fully to premorbid functioning. Which diagnosis is most appropriate-",Schizophrenia,Schizophreniform Disorder,Brief Psychotic Disorder,Delusional Disorder,3,"Brief psychotic disorder involves psychotic symptoms lasting at least 1 day but less than 1 month, followed by eventual full return to premorbid functioning.",Medium,Abnormal Psychology,Chapter 13: Chapter 13,Chapter 13
Schizoaffective disorder is diagnosed when:,Mood symptoms are absent throughout the illness,Mood symptoms occur only after psychosis has completely resolved,"A major mood episode is present for the majority of the total duration of the illness, and there is also a period of psychosis without prominent mood symptoms","Delusions are the only psychotic symptom present for at least one month illness, and there is also a period of psychosis without prominent mood symptoms",3,"Schizoaffective disorder requires both a major mood episode and schizophrenia-type psychotic symptoms, plus at least a 2-week period of delusions or hallucinations without prominent mood symptoms. Mood episodes must occupy the majority of the total illness duration.",Medium,Abnormal Psychology,Chapter 13: Chapter 13,Chapter 13
Which statement best differentiates schizophrenia from major depressive disorder with psychotic features-,"In schizophrenia, psychotic symptoms occur only during mood episodes","In schizophrenia, psychotic symptoms may occur outside mood episodes, and mood episodes, if present, occupy only a minority of the illness duration","In schizophrenia, catatonia cannot occur","In schizophrenia, functioning is always preserved mood episodes, if present, occupy only a minority of the illness duration",2,"In schizophrenia, psychotic symptoms are not confined to mood episodes. If mood episodes occur, they occupy only a minority of the total duration of the illness. This helps distinguish it from mood disorders with psychotic features and schizoaffective disorder.",Medium,Abnormal Psychology,Chapter 13: Chapter 13,Chapter 13
Which of the following would most strongly suggest delusional disorder rather than schizophrenia-,Flat affect and avolition,"One month of nonbizarre delusions without prominent hallucinations, disorganized speech, or negative symptoms",Grossly disorganized behavior with persecutory delusions,"Auditory hallucinations with loose associations disorganized speech, or negative symptoms",2,"That presentation fits delusional disorder because the psychosis is limited to delusions, and the broader active-phase symptoms of schizophrenia are absent.",Medium,Abnormal Psychology,Chapter 13: Chapter 13,Chapter 13
Which of the following is most characteristic of avolition-,Increased goal-directed behavior,Decreased ability to recognize familiar faces,Reduction in self-initiated purposeful activities,Excessive worry about future events,3,"Avolition specifically refers to decreased motivation and reduced engagement in purposeful activity, such as work, self-care, or social tasks.",Medium,Abnormal Psychology,Chapter 13: Chapter 13,Chapter 13
Which of the following is an example of diminished emotional expression-,Euphoric mood during a stressful interview,"Reduced eye contact, flattened prosody, and decreased facial expressiveness",Pressured speech and distractibility,Repetitive checking behavior,2,"Diminished emotional expression includes reduced facial expression, eye contact, prosody, and gestures that would normally add emotional tone to speech.",Medium,Abnormal Psychology,Chapter 13: Chapter 13,Chapter 13
Which diagnosis should be considered first when psychotic symptoms appear after recent substance use-,Schizotypal Personality Disorder,Substance/Medication-Induced Psychotic Disorder,Delusional Disorder,Schizoaffective Disorder,2,"When psychotic symptoms arise after recent substance use, a substance-induced cause must be ruled out first because substances can directly cause psychotic presentations.",Medium,Abnormal Psychology,Chapter 13: Chapter 13,Chapter 13
"A patient with hallucinations is fully aware that the perceptual disturbance began after hallucinogen use and recognizes that it is drug-related. In differential diagnosis, this presentation is best classified as:",Schizophrenia,Delusional Disorder,A non-primary psychotic presentation related to substance use,Schizoaffective Disorder,3,"If the person recognizes the hallucination-like experience as related to hallucinogen use and retains reality testing, it should not be counted in the same way as a primary psychotic disorder symptom.",Medium,Abnormal Psychology,Chapter 13: Chapter 13,Chapter 13
Which of the following would make an additional diagnosis of schizophrenia in a person with autism spectrum disorder more likely-,Social communication deficits alone,Restricted interests alone,Prominent delusions or hallucinations present for at least one month,History of language delay alone,3,"In individuals with autism spectrum disorder or childhood-onset communication disorder, schizophrenia should be additionally diagnosed only if prominent delusions or hallucinations are present for at least one month.",Medium,Abnormal Psychology,Chapter 13: Chapter 13,Chapter 13
Which of the following best describes the duration requirement for schizophreniform disorder-,At least 1 day but less than 1 month,At least 1 month but less than 6 months,At least 6 months,At least 2 weeks but less than 4 weeks,2,Schizophreniform disorder occupies the middle duration range between brief psychotic disorder and schizophrenia.,Medium,Abnormal Psychology,Chapter 13: Chapter 13,Chapter 13
"A client with chronic psychosis develops depressive and manic episodes, but together they occupy only a small portion of the total duration of illness. Which diagnosis is most appropriate-",Schizoaffective Disorder,Schizophrenia,Bipolar I Disorder with psychotic features,Major Depressive Disorder with psychotic features,2,"If mood episodes occupy only a minority of the total duration of a chronic psychotic illness, schizophrenia is more appropriate than schizoaffective disorder.",Medium,Abnormal Psychology,Chapter 13: Chapter 13,Chapter 13
Which of the following psychotic presentations is most likely to be diagnosed as brief psychotic disorder-,Psychotic symptoms for 8 months with marked occupational decline,Delusions only for 2 months,Psychotic symptoms for 2 weeks with eventual full return to premorbid functioning,Hallucinations occurring only during manic episodes functioning,3,"That presentation matches brief psychotic disorder because duration is between 1 day and less than 1 month, with eventual full return to premorbid functioning.",Medium,Abnormal Psychology,Chapter 13: Chapter 13,Chapter 13
Which symptom pair is identified as especially prominent among the negative symptoms in schizophrenia-,Echolalia and echopraxia,Delusions and hallucinations,Diminished emotional expression and avolition,Panic and derealization,3,DSM-based descriptions identify diminished emotional expression and avolition as especially prominent negative symptoms in schizophrenia.,Medium,Abnormal Psychology,Chapter 13: Chapter 13,Chapter 13
Which of the following is most characteristic of schizoaffective disorder-,Delusions limited to one month with no other psychotic symptoms,Psychotic symptoms only during a manic or depressive episode,"A lifetime pattern in which mood episodes are present for the majority of the total illness duration, with at least two weeks of delusions or hallucinations without prominent mood symptoms","A psychotic episode lasting less than one month after a stressor total illness duration, with at least two weeks of delusions or hallucinations without prominent mood symptoms",3,This is the defining diagnostic pattern of schizoaffective disorder and requires longitudinal assessment across the course of illness.,Medium,Abnormal Psychology,Chapter 13: Chapter 13,Chapter 13
Which of the following most strongly supports a diagnosis of major depressive disorder with psychotic features rather than schizoaffective disorder-,Psychotic symptoms continue for months after mood symptoms remit,Delusions occur only during major depressive episodes,Mood episodes occupy the majority of the illness duration,There is a two-week period of hallucinations without mood symptoms,2,"When psychotic symptoms occur exclusively during mood episodes, the more appropriate diagnosis is a mood disorder with psychotic features rather than schizoaffective disorder.",Medium,Abnormal Psychology,Chapter 13: Chapter 13,Chapter 13
"A patient has fixed persecutory beliefs for 5 months, remains organized in speech, shows no marked negative symptoms, and has no prominent hallucinations. Which diagnosis is most likely-",Delusional Disorder,Schizophrenia,Schizophreniform Disorder,Brief Psychotic Disorder,1,"Persistent fixed delusions for more than one month without prominent hallucinations, disorganization, or negative symptoms most strongly supports delusional disorder.",Medium,Abnormal Psychology,Chapter 13: Chapter 13,Chapter 13
Which of the following is a key functional criterion associated with schizophrenia but not required for schizophreniform disorder-,Presence of delusions,Presence of hallucinations,Marked decline in one or more major areas of functioning,Presence of grossly disorganized behavior,3,"Marked decline in functioning is part of schizophrenia's diagnostic framework, whereas schizophreniform disorder does not require this decline for diagnosis.",Medium,Abnormal Psychology,Chapter 13: Chapter 13,Chapter 13
Which of the following presentations most strongly suggests that catatonia is associated with a medical condition rather than a primary psychotic disorder-,Catatonia with auditory hallucinations and delusions,Catatonia occurring exclusively during a disturbance in attention and awareness due to delirium,Catatonia during a chronic schizophrenia spectrum illness,Catatonia during a major depressive episode awareness due to delirium,2,"When catatonic symptoms appear in the context of delirium or another clear medical process affecting attention and awareness, a medical explanation should be prioritized.",Medium,Abnormal Psychology,Chapter 13: Chapter 13,Chapter 13
Which statement about culturally sanctioned experiences is most accurate in psychotic assessment-,They should automatically be coded as delusions,They should automatically be diagnosed as hallucinations,They should not be counted as psychotic symptoms when they are culturally or religiously sanctioned,They always indicate brief psychotic disorder or religiously sanctioned,3,Psychotic assessment requires cultural competence. Experiences that are culturally or religiously sanctioned should not be automatically pathologized as psychosis.,Medium,Abnormal Psychology,Chapter 13: Chapter 13,Chapter 13
Which of the following is the best example of disorganized speech in a psychotic disorder-,Speaking softly with reduced volume,Providing brief but accurate responses,Frequent derailment or incoherence,Repeating a traumatic memory in detail,3,"Disorganized speech in psychotic disorders includes derailment, incoherence, tangentiality, and related thought-disorganization patterns.",Medium,Abnormal Psychology,Chapter 13: Chapter 13,Chapter 13
Which of the following would most strongly suggest schizophrenia rather than PTSD-,Hypervigilance after trauma exposure,Flashbacks linked to traumatic reminders,Persistent psychotic symptoms with characteristic negative symptoms and decline in functioning,Avoidance of trauma-related cues decline in functioning,3,"PTSD can include flashback-like or paranoid-seeming experiences, but persistent psychosis with negative symptoms and marked functional decline more strongly indicates schizophrenia.",Medium,Abnormal Psychology,Chapter 13: Chapter 13,Chapter 13
"A psychometrician is asked to independently diagnose a complex psychotic disorder case beyond the limits of their competence and training. Under ethical standards and RA 10029-aligned practice, the most appropriate action is to:",Proceed independently to avoid delay in service,Diagnose the case as schizophrenia if delusions are present,Make an appropriate referral or work within supervision and competence limits,Rely solely on a test score to assign diagnosis,3,Philippine ethical standards require practitioners to work within boundaries of competence and to make appropriate referrals when competence is insufficient. This is especially important in complex psychotic cases.,Medium,Abnormal Psychology,Chapter 13: Chapter 13,Chapter 13
Which ethical principle is most relevant when handling sensitive assessment data from a client with psychotic symptoms-,Mandatory public disclosure of unusual beliefs,Protection of confidentiality and respect for dignity,Preference for organizational convenience over client welfare,Avoidance of record keeping,2,"The PAP Code emphasizes respect for dignity, privacy, and protection of confidentiality. These are critical when handling assessment information from vulnerable clients, including those with psychotic symptoms.",Medium,Abnormal Psychology,Chapter 13: Chapter 13,Chapter 13
"In a forensic setting, a psychology practitioner handling psychosis-related assessment should be especially guided by which standard-",Personal opinion over professional knowledge,Familiarity with relevant judicial or administrative rules within one's competence,Complete suspension of confidentiality without clarification,Diagnosis based only on collateral reports competence,2,"When assuming forensic roles, practitioners are expected to be familiar with relevant judicial or administrative rules and to remain within competence boundaries.",Medium,Abnormal Psychology,Chapter 13: Chapter 13,Chapter 13
Which of the following best describes the proper role of a psychometrician in psychosis-related testing under Philippine ethical practice-,Administer and interpret any assessment regardless of training,Work only within boundaries of competence and use established scientific and professional knowledge,Publicly disclose results to family without consent,Diagnose solely from one projective test professional knowledge,2,"The ethical role of the psychometrician requires competence, scientific grounding, and adherence to lawful scope of practice. Psychosis-related assessment should be conducted only within training and professional limits.",Medium,Abnormal Psychology,Chapter 13: Chapter 13,Chapter 13
Which of the following most clearly distinguishes brief psychotic disorder from schizophreniform disorder-,Presence of hallucinations,Presence of negative symptoms,Total duration of the psychotic disturbance,Age at onset,3,"Brief psychotic disorder and schizophreniform disorder may look similar symptomatically; the key distinction is duration. Brief psychotic disorder is less than 1 month, while schizophreniform disorder is 1 to less than 6 months.",Medium,Abnormal Psychology,Chapter 13: Chapter 13,Chapter 13
A clinician notes that a patient's psychotic symptoms began after a head injury and are judged to be a direct physiological consequence of that condition. Which diagnosis should be prioritized-,Schizophrenia,Delusional Disorder,Psychotic Disorder Due to Another Medical Condition,Schizotypal Personality Disorder,3,"When psychotic symptoms are judged to be the direct physiological consequence of a medical condition such as head injury, a medical-condition-based psychotic diagnosis should take priority.",Medium,Abnormal Psychology,Chapter 13: Chapter 13,Chapter 13
Which of the following is most characteristic of schizotypal personality disorder rather than schizophrenia-,Persistent auditory hallucinations and marked functional decline,Pervasive social and interpersonal deficits with cognitive or perceptual distortions below the threshold for psychosis,Grossly disorganized behavior during an acute psychotic episode,Delusions for at least one month with full conviction distortions below the threshold for psychosis,2,"Schizotypal personality disorder involves odd beliefs, interpersonal deficits, and cognitive-perceptual distortions, but these remain below the threshold for a full psychotic disorder.",Medium,Abnormal Psychology,Chapter 13: Chapter 13,Chapter 13
Why is a careful longitudinal history essential in distinguishing schizophrenia from schizoaffective disorder-,Because psychotic symptoms never overlap with mood symptoms,Because the diagnosis depends partly on the proportion of illness duration occupied by mood episodes,Because schizophrenia can be diagnosed after one day of symptoms,Because schizoaffective disorder requires no psychotic symptoms occupied by mood episodes,2,Distinguishing schizophrenia from schizoaffective disorder requires longitudinal tracking of mood and psychotic symptoms over time. The proportion of total illness occupied by mood episodes is diagnostically central.,Medium,Abnormal Psychology,Chapter 13: Chapter 13,Chapter 13
Which of the following best illustrates alogia-,Increased speech with flight of ideas,Diminished speech output,Repetitive motor behavior,Confabulation after head trauma,2,Alogia is a negative symptom characterized by reduced speech output and poverty of speech.,Medium,Abnormal Psychology,Chapter 13: Chapter 13,Chapter 13
"A patient in the emergency room presents with psychotic symptoms, but information is still insufficient and contradictory. Which diagnosis may be used provisionally when full criteria for a specific psychotic disorder cannot yet be determined-",Unspecified Schizophrenia Spectrum and Other Psychotic Disorder,Delusional Disorder,Schizophrenia,Schizoaffective Disorder,1,"When psychotic symptoms are present but available information is insufficient or contradictory, an unspecified schizophrenia spectrum and other psychotic disorder diagnosis may be used provisionally.",Medium,Abnormal Psychology,Chapter 13: Chapter 13,Chapter 13
Neurodevelopmental disorders are best described as conditions that:,Begin only after puberty and primarily involve mood instability,"Usually begin in the developmental period and produce impairments in personal, social, academic, or occupational functioning",Always arise from identifiable brain injury acquired in adulthood,"Are limited to problems in language development only personal, social, academic, or occupational functioning",2,Neurodevelopmental disorders typically begin during the developmental period and are marked by deficits or differences in brain processes that impair functioning across major life areas.,Medium,Abnormal Psychology,Chapter 14: Chapter 14,Chapter 14
A developmental principle important in understanding neurodevelopmental disorders is that:,Later-acquired skills always develop normally even if early skills are disrupted,Delays in one early skill may interfere with mastery of later skills,Neurodevelopmental disorders remain fixed and unaffected by psychosocial influences,Early intervention has little effect because these conditions are biologically determined,2,"A core developmental psychopathology principle is that development proceeds sequentially, so disruption of early skills can impair later skill acquisition.",Medium,Abnormal Psychology,Chapter 14: Chapter 14,Chapter 14
"A child is repeatedly unable to sustain attention in class, loses school materials, forgets assignments, and interrupts others excessively. The best diagnosis is:",Specific learning disorder,Autism spectrum disorder,Attention-deficit/hyperactivity disorder,Social (pragmatic) communication disorder,3,"The pattern of inattention, disorganization, forgetfulness, and impulsive interruption is classic for ADHD.",Medium,Abnormal Psychology,Chapter 14: Chapter 14,Chapter 14
Which feature is most central to the inattentive dimension of ADHD-,Excessive fear of social evaluation,Inability to stay on task and seeming not to listen,Persistent deficits in social reciprocity with repetitive behavior,Marked impairment in articulation only,2,"DSM-consistent descriptions of inattention in ADHD include poor sustained attention, seeming not to listen, and failure to persist on tasks.",Medium,Abnormal Psychology,Chapter 14: Chapter 14,Chapter 14
Which statement regarding ADHD is most accurate-,It is always outgrown by adolescence,It affects only academic functioning,"It may persist into adulthood and impair social, academic, and occupational functioning",It cannot co-occur with other neurodevelopmental disorders functioning,3,ADHD commonly persists beyond childhood and can continue to impair functioning across settings into adulthood.,Medium,Abnormal Psychology,Chapter 14: Chapter 14,Chapter 14
"A 10-year-old performs poorly in reading despite average intelligence, adequate opportunity to learn, and no global intellectual deficit. The most appropriate diagnosis is:",Intellectual developmental disorder,Specific learning disorder,Language disorder,Autism spectrum disorder,2,Persistent academic underperformance in a circumscribed area despite adequate opportunity and without global intellectual deficit strongly supports specific learning disorder.,Medium,Abnormal Psychology,Chapter 14: Chapter 14,Chapter 14
Specific learning disorder most typically first becomes evident:,During infancy,During the years of formal schooling,Only during late adulthood,Immediately after a traumatic brain injury,2,"Specific learning disorder usually becomes apparent when formal academic demands reveal persistent impairment in reading, writing, or mathematics.",Medium,Abnormal Psychology,Chapter 14: Chapter 14,Chapter 14
Which set of difficulties is most consistent with specific learning disorder-,"Reading, written expression, and mathematics difficulties that are persistent and impairing",Hallucinations and delusions,"Hyperphagia, obesity, and sleep disturbance",Social anxiety and panic attacks only and impairing,1,These are the foundational academic domains in which specific learning disorder is identified.,Medium,Abnormal Psychology,Chapter 14: Chapter 14,Chapter 14
