Question,Choice 1,Choice 2,Choice 3,Choice 4,Correct Answer (1-4),Explanation,Difficulty,Subject,Chapter,Topic
Which factor should be considered in the clinical assessment of sexual dysfunction because it may contribute to etiology or treatment-,Partner factors only,Biological factors only,"Relationship, individual vulnerability, cultural, and medical factors",Astrological compatibility,3,"Assessment should consider partner factors, relationship dynamics, individual vulnerabilities, psychiatric comorbidity, stressors, cultural or religious influences, and relevant medical conditions.",Medium,Abnormal Psychology,Chapter 10: Chapter 10,Chapter 10
A client reports inability to reach orgasm because neither the client nor the partner has knowledge of effective sexual stimulation. Which is the best diagnostic conclusion-,Sexual dysfunction should automatically be diagnosed,A paraphilic disorder should be diagnosed,"Clinical judgment may indicate need for care, but a sexual dysfunction diagnosis may not be warranted",Gender dysphoria should be ruled in first diagnosis may not be warranted,3,"DSM-based guidance notes that lack of effective stimulation or knowledge may warrant care or psychoeducation, but does not necessarily justify a sexual dysfunction diagnosis.",Medium,Abnormal Psychology,Chapter 10: Chapter 10,Chapter 10
Which statement best reflects the multidimensional understanding of sexual function-,Sexual function is purely biological,Sexual function is purely learned,"Sexual function reflects the interaction of biological, psychological, sociocultural, and interpersonal factors","Sexual function is determined only by religious upbringing sociocultural, and interpersonal factors",3,Sexual functioning is multidetermined and cannot be adequately understood through a one-factor explanation.,Medium,Abnormal Psychology,Chapter 10: Chapter 10,Chapter 10
Which condition is classified as a sexual dysfunction in DSM-5-TR-,Gender dysphoria,Fetishistic disorder,Female sexual interest/arousal disorder,Voyeuristic disorder,3,Female sexual interest/arousal disorder is one of the sexual dysfunctions listed in DSM-5-TR.,Medium,Abnormal Psychology,Chapter 10: Chapter 10,Chapter 10
Which condition is classified as a paraphilic disorder rather than a sexual dysfunction-,Premature (early) ejaculation,Female orgasmic disorder,Fetishistic disorder,Genito-pelvic pain/penetration disorder,3,"Fetishistic disorder belongs to the paraphilic disorders, not the sexual dysfunctions.",Medium,Abnormal Psychology,Chapter 10: Chapter 10,Chapter 10
Which condition is characterized by recurrent and intense sexual arousal from touching or rubbing against a nonconsenting person-,Voyeuristic disorder,Fetishistic disorder,Frotteuristic disorder,Transvestic disorder,3,Frotteuristic disorder involves recurrent and intense sexual arousal from touching or rubbing against a nonconsenting person.,Medium,Abnormal Psychology,Chapter 10: Chapter 10,Chapter 10
Which disorder is most associated with exposing one's genitals to an unsuspecting nonconsenting person-,Exhibitionistic disorder,Voyeuristic disorder,Sexual sadism disorder,Pedophilic disorder,1,Exhibitionistic disorder is characterized by sexual arousal associated with exposing the genitals to a nonconsenting person.,Medium,Abnormal Psychology,Chapter 10: Chapter 10,Chapter 10
"Which disorder is most associated with recurrent and intense sexual arousal from observing an unsuspecting person who is naked, disrobing, or engaged in sexual activity-",Frotteuristic disorder,Voyeuristic disorder,Fetishistic disorder,Transvestic disorder,2,"Voyeuristic disorder centers on sexual arousal from observing an unsuspecting person who is naked, disrobing, or sexually active.",Medium,Abnormal Psychology,Chapter 10: Chapter 10,Chapter 10
Which statement best distinguishes paraphilia from paraphilic disorder-,A paraphilia always requires hospitalization,A paraphilic disorder exists only when the sexual interest is illegal,A paraphilia becomes a disorder when it causes distress or impairment to the individual or its satisfaction entails harm or risk of harm to others,There is no distinction between the two terms individual or its satisfaction entails harm or risk of harm to others,3,"DSM distinguishes paraphilia from paraphilic disorder. The interest alone is not enough; disorder requires distress, impairment, or harm/risk of harm to others.",Medium,Abnormal Psychology,Chapter 10: Chapter 10,Chapter 10
"Which grouping correctly classifies voyeuristic, exhibitionistic, and frotteuristic disorders-",Gender identity disorders,Courtship disorders,Orgasm disorders,Dissociative disorders,2,"Voyeuristic, exhibitionistic, and frotteuristic disorders are grouped as courtship disorders because they resemble distorted components of human courtship behavior.",Medium,Abnormal Psychology,Chapter 10: Chapter 10,Chapter 10
Which grouping correctly classifies sexual sadism disorder and sexual masochism disorder-,Courtship disorders,Target-preference disorders,Algolagnic disorders,Dissociative disorders,3,"Sexual sadism disorder and sexual masochism disorder are algolagnic disorders because they involve pain, suffering, humiliation, or bondage.",Medium,Abnormal Psychology,Chapter 10: Chapter 10,Chapter 10
Which statement is most accurate regarding fetishistic disorder-,Any preference for a partner's body part is automatically a disorder,"It may involve nonliving objects or a highly specific focus on a nongenital body part, but diagnosis requires clinically significant distress or impairment",It is diagnosed only when cross-dressing is present,"It is more common in women than in men in clinical samples part, but diagnosis requires clinically significant distress or impairment",2,"Fetishistic disorder may involve nonliving objects or a nongenital body part as the primary focus of arousal, but diagnosis requires clinically significant distress or impairment.",Medium,Abnormal Psychology,Chapter 10: Chapter 10,Chapter 10
Which of the following is the nearest diagnostic neighbor of fetishistic disorder when fetish objects are limited to clothing worn during cross-dressing-,Voyeuristic disorder,Pedophilic disorder,Transvestic disorder,Sexual sadism disorder,3,"When fetish objects are limited to clothing worn during cross-dressing, the differential diagnosis most closely points to transvestic disorder.",Medium,Abnormal Psychology,Chapter 10: Chapter 10,Chapter 10
Which statement best reflects the DSM-5-TR view of pedophilic disorder-,Any sexual offense against a minor automatically proves pedophilic disorder,"The diagnosis may be considered when there is recurrent, intense sexual arousal involving prepubescent children, together with distress, impairment, or acted-on urges",Childhood sexual abuse is an established sole cause,"The diagnosis is limited to women arousal involving prepubescent children, together with distress, impairment, or acted-on urges",2,"Pedophilic disorder requires a persistent pedophilic interest plus clinically significant distress/impairment or acted-on urges, not merely a single allegation or offense.",Medium,Abnormal Psychology,Chapter 10: Chapter 10,Chapter 10
"A man sexually abuses a child during intoxication, but there is no evidence of recurrent preferential attraction to prepubescent children over time. Which conclusion is best-",Pedophilic disorder is automatically diagnosed,Only antisocial personality disorder can be diagnosed,Pedophilic disorder should not be diagnosed without evidence of persistent pedophilic interest meeting full criteria,Gender dysphoria should be considered first pedophilic interest meeting full criteria,3,"A sexual offense against a child may occur for reasons other than a persistent pedophilic interest. Full diagnostic criteria still require evidence of recurrent, intense arousal pattern over time.",Medium,Abnormal Psychology,Chapter 10: Chapter 10,Chapter 10
Which statement about transvestic disorder is most accurate-,It is identical to gender dysphoria,It refers to sexually arousing cross-dressing and may in some cases co-occur with gender dysphoria,It is a subtype of fetishistic disorder in all cases,It is diagnosed whenever a person wears clothing associated with another gender with gender dysphoria,2,Transvestic disorder involves sexually arousing cross-dressing. In some individuals it may coexist with clinically significant gender dysphoria.,Medium,Abnormal Psychology,Chapter 10: Chapter 10,Chapter 10
Which statement best describes gender dysphoria-,It is a sexual dysfunction involving lack of arousal,It is a paraphilic disorder involving atypical sexual targets,"It is marked by incongruence between experienced gender and assigned gender, usually accompanied by clinically significant distress or impairment","It is synonymous with homosexuality gender, usually accompanied by clinically significant distress or impairment",3,"Gender dysphoria centers on distressing incongruence between experienced gender and assigned gender, not on sexual dysfunction or atypical sexual targets.",Medium,Abnormal Psychology,Chapter 10: Chapter 10,Chapter 10
Which feature is central in gender dysphoria among adolescents and adults-,Persistent visual hallucinations,Incongruence between experienced gender and assigned gender,Compulsive sexual behavior,Exclusive fetishistic interest in clothing,2,"In adolescents and adults, the central diagnostic feature is incongruence between experienced gender and assigned gender.",Medium,Abnormal Psychology,Chapter 10: Chapter 10,Chapter 10
Which statement best explains why gender dysphoria is not classified as a sexual dysfunction-,Because it does not involve any distress,Because it concerns gender incongruence rather than disturbance in sexual response,Because it always begins in childhood,Because it is always caused by family conflict response,2,"Gender dysphoria is classified separately because its core issue is gender incongruence and related distress, not impaired desire, arousal, orgasm, or pain response.",Medium,Abnormal Psychology,Chapter 10: Chapter 10,Chapter 10
"A child persistently insists on being another gender, prefers roles and play associated with that gender, and becomes increasingly distressed when puberty approaches. Which diagnosis is most consistent-",Fetishistic disorder,Gender dysphoria,Voyeuristic disorder,Delusional disorder,2,"Persistent insistence on being another gender, marked cross-gender identification, and increasing distress around anticipated puberty are classic indicators consistent with gender dysphoria.",Medium,Abnormal Psychology,Chapter 10: Chapter 10,Chapter 10
Which statement is most accurate regarding the course of gender dysphoria in children-,It invariably persists into adulthood,It always disappears before adolescence,"It may persist, desist, or recur later in life",It is diagnosed only after age 18,3,"The course of gender dysphoria in childhood is variable. Some cases persist, some desist, and some may recur later.",Medium,Abnormal Psychology,Chapter 10: Chapter 10,Chapter 10
Which factor may reduce distress associated with gender dysphoria-,Punitive correction of gender nonconformity,Supportive environments and knowledge that treatments exist to reduce incongruence,Forced disclosure in school settings,Exposure-based aversion procedures incongruence,2,"Supportive environments can mitigate distress, and awareness of treatment options may reduce suffering associated with gender incongruence.",Medium,Abnormal Psychology,Chapter 10: Chapter 10,Chapter 10
Which condition may complicate the differential diagnosis of gender dysphoria because concrete and rigid thinking about gender roles may resemble gender-related preoccupation-,Autism spectrum disorder,Panic disorder,Substance intoxication,Specific learning disorder,1,DSM notes that autism spectrum disorder may complicate diagnosis because rigid and concrete thinking about gender roles may resemble or obscure co-occurring gender dysphoria.,Medium,Abnormal Psychology,Chapter 10: Chapter 10,Chapter 10
Which statement best distinguishes gender dysphoria from psychotic delusions-,All statements about being another gender are delusional,"In the absence of psychotic symptoms, insistence on being another gender is not considered a delusion",Gender dysphoria is diagnosed only when bizarre delusions are present,Psychosis and gender dysphoria can never co-occur not considered a delusion,2,Gender dysphoria is not delusional merely because a person firmly identifies with another gender. Psychosis is considered when bizarre gender-themed beliefs occur in the context of psychotic symptoms.,Medium,Abnormal Psychology,Chapter 10: Chapter 10,Chapter 10
A psychometrician in the Philippines is asked to independently conduct a specialized sexual-behavior assessment beyond the limits of current competence. Which action is most ethical-,Proceed alone to avoid disappointing the referral source,Refuse all involvement without considering referral,Practice only within competence and make an appropriate referral if needed,Administer any available test and let the referring physician interpret it,3,Philippine ethical standards require psychologists and psychometricians to work within boundaries of competence and make appropriate referrals when existing competence is insufficient.,Medium,Abnormal Psychology,Chapter 10: Chapter 10,Chapter 10
Which ethical principle is most relevant when handling highly sensitive information about a client's sexual history during assessment-,Competitive disclosure,Confidentiality and privacy,Diagnostic rigidity,Personal curiosity,2,"Sexual history is highly sensitive information, so confidentiality and respect for privacy are central ethical obligations in assessment and intervention.",Medium,Abnormal Psychology,Chapter 10: Chapter 10,Chapter 10
"A psychometrician is asked by a client's relative to release raw sexual assessment data without the client's permission. According to ethical standards, the best response is to:",Release the data because a relative requested it,Release only scaled scores,Withhold raw test data unless release is authorized or legally required,Postpone only if the relative seems upset,3,"Ethical standards state that raw test data should not be released to unauthorized persons, except when legally regulated, such as by court order.",Medium,Abnormal Psychology,Chapter 10: Chapter 10,Chapter 10
Which practice is most consistent with ethical assessment conduct in the Philippines-,Using any test available online if it appears relevant,"Using standardized, valid, reliable tools appropriate to the client's language and characteristics",Releasing results to all interested parties for transparency,Interpreting outdated results if no new data are available and characteristics,2,"Ethical assessment requires scientifically sound tools with appropriate standardization, validity, reliability, and relevance to the client's characteristics and language.",Medium,Abnormal Psychology,Chapter 10: Chapter 10,Chapter 10
A professor requires psychology students to publicly disclose their sexual history as part of training in psychopathology. Which ethical judgment is most appropriate-,This is acceptable if the professor is curious about class diversity,This is acceptable if students are graded fairly,This is generally unethical because students should not be required to disclose highly personal information such as sexual history except under limited justified conditions,This is required for competence development disclose highly personal information such as sexual history except under limited justified conditions,3,"Ethical standards in education and training state that students or supervisees should not be compelled to disclose highly personal information such as sexual history except in narrow, justified circumstances.",Medium,Abnormal Psychology,Chapter 10: Chapter 10,Chapter 10
Which statement best describes a substance use disorder-,Any use of a psychoactive substance automatically qualifies as a disorder,A maladaptive pattern of substance use that leads to clinically significant impairment or distress,Any use of an illegal drug regardless of consequences,A pattern of substance use that is diagnosed only when withdrawal is present impairment or distress,2,"This captures the defining feature of a substance use disorder: a problematic pattern of use associated with clinically significant distress, impairment, loss of control, or continued use despite harmful consequences.",Medium,Abnormal Psychology,Chapter 11: Chapter 11,Chapter 11
Which pair consists of core features commonly associated with physiological dependence-,Hallucinations and delusions,Tolerance and withdrawal,Euphoria and relaxation,Craving and denial,2,Tolerance and withdrawal are the classic physiological indicators of dependence in substance-related disorders.,Medium,Abnormal Psychology,Chapter 11: Chapter 11,Chapter 11
A person needs increasing amounts of a stimulant to achieve the same desired effect. This phenomenon is best termed:,Intoxication,Withdrawal,Tolerance,Relapse,3,Tolerance refers to needing a larger amount of a substance to obtain the same effect or experiencing reduced effect from the same amount.,Medium,Abnormal Psychology,Chapter 11: Chapter 11,Chapter 11
Which of the following is the clearest example of withdrawal-,A student becomes talkative after drinking coffee,A smoker develops irritability after stopping nicotine use,A person lies about gambling losses,A client feels guilty after stealing an item,2,"Withdrawal refers to symptoms that occur after reducing or stopping repeated substance use, and irritability after nicotine cessation is a classic example.",Medium,Abnormal Psychology,Chapter 11: Chapter 11,Chapter 11
Which is the best distinction between substance intoxication and substance use disorder-,"Intoxication refers to a chronic pattern, whereas use disorder refers to a temporary state","Intoxication refers to reversible substance-specific effects, whereas use disorder refers to a problematic pattern of use","Intoxication requires tolerance, whereas use disorder does not",Intoxication and use disorder are synonymous terms disorder refers to a problematic pattern of use,2,"Intoxication is a temporary, reversible state caused by recent substance use, whereas substance use disorder refers to a broader maladaptive pattern marked by distress or impairment.",Medium,Abnormal Psychology,Chapter 11: Chapter 11,Chapter 11
Which class of substances is primarily associated with increased alertness and energy-,Depressants,Opioids,Stimulants,Hallucinogens,3,"Stimulants increase central nervous system activity and are associated with alertness, arousal, and increased energy.",Medium,Abnormal Psychology,Chapter 11: Chapter 11,Chapter 11
Which of the following is classified as a stimulant-,Heroin,Cocaine,Alcohol,Diazepam,2,"Cocaine is a prototypical stimulant that increases energy, alertness, and arousal.",Medium,Abnormal Psychology,Chapter 11: Chapter 11,Chapter 11
"A client has recurrent cocaine use, intense craving, repeated failure to cut down, and continued use despite occupational impairment. Which diagnosis is most likely-",Cocaine intoxication only,Cocaine withdrawal only,Stimulant use disorder,Gambling disorder,3,"The pattern includes craving, failed attempts to reduce use, and continued use despite impairment, which are core indicators of stimulant use disorder.",Medium,Abnormal Psychology,Chapter 11: Chapter 11,Chapter 11
Which feature is especially useful in identifying problematic stimulant use-,Persistent oversleeping without craving,Recurrent use in physically hazardous situations,Increased appetite and psychomotor slowing,Compulsive fire-setting,2,Recurrent use in hazardous situations is one of the clinically significant indicators of problematic stimulant use.,Medium,Abnormal Psychology,Chapter 11: Chapter 11,Chapter 11
Which statement about prescribed stimulant medication is most accurate-,Tolerance always counts toward diagnosis even when taken as prescribed,Withdrawal always counts toward diagnosis even when taken as prescribed,Tolerance and withdrawal do not automatically count when stimulants are taken solely under appropriate medical supervision,Prescribed use can never be associated with any disorder taken solely under appropriate medical supervision,3,Expected physiological adaptation during appropriate prescribed medical treatment does not automatically count as evidence of a disorder.,Medium,Abnormal Psychology,Chapter 11: Chapter 11,Chapter 11
"A person with heavy prolonged opioid use stops abruptly and then develops dysphoric mood, nausea, muscle aches, sweating, diarrhea, yawning, and insomnia. This presentation is most consistent with:",Opioid intoxication,Opioid withdrawal,Sedative intoxication,Cannabis intoxication,2,This cluster of symptoms after abrupt cessation of prolonged opioid use is characteristic of opioid withdrawal.,Medium,Abnormal Psychology,Chapter 11: Chapter 11,Chapter 11
Which of the following findings is more characteristic of opioid intoxication than opioid withdrawal-,Pupillary dilation,Yawning,Constricted pupils,Insomnia,3,"Constricted pupils are classically associated with opioid intoxication, whereas withdrawal more commonly involves dilation and autonomic distress.",Medium,Abnormal Psychology,Chapter 11: Chapter 11,Chapter 11
Which statement best reflects the distinction between gambling disorder and a manic episode-,Gambling disorder can never involve risky decision-making,Gambling disorder is diagnosed when problematic gambling is better explained by mania,Gambling disorder should not be diagnosed if the gambling behavior is better explained by a manic episode,Mania and gambling disorder are always diagnosed together explained by a manic episode,3,A diagnosis of gambling disorder should not be made when the behavior is better accounted for by a manic episode.,Medium,Abnormal Psychology,Chapter 11: Chapter 11,Chapter 11
Which of the following is NOT one of the diagnostic indicators of gambling disorder-,Chasing one's losses,Repeated unsuccessful efforts to stop gambling,Persistent preoccupation with gambling,Recurrent fire-setting for pleasure,4,"Recurrent fire-setting for pleasure is associated with pyromania, not gambling disorder.",Medium,Abnormal Psychology,Chapter 11: Chapter 11,Chapter 11
A person repeatedly returns to gambling after losses in an attempt to win back money already lost. This is best described as:,Telescoping,Chasing losses,Tolerance,Dissociation,2,Chasing losses refers to returning to gamble in order to recover money already lost and is a hallmark feature of gambling disorder.,Medium,Abnormal Psychology,Chapter 11: Chapter 11,Chapter 11
Gambling disorder is currently classified under:,Neurocognitive disorders,Obsessive-compulsive and related disorders,Substance-related and addictive disorders,Personality disorders,3,Gambling disorder is classified with addictive disorders because it shares important clinical features with substance-related addictions.,Medium,Abnormal Psychology,Chapter 11: Chapter 11,Chapter 11
Which statement best explains why gambling disorder is grouped with addictive disorders-,It always involves ingestion of a psychoactive substance,It shares clinical and neurobiological features with substance-related disorders,It is always caused by antisocial personality disorder,It is primarily a psychotic condition,2,"Gambling disorder is grouped with addictive disorders because of similarities in craving, reward processes, impulse dysregulation, and relapse patterns.",Medium,Abnormal Psychology,Chapter 11: Chapter 11,Chapter 11
Which of the following is a strong board-relevant indicator of gambling disorder severity-,Number of psychotic symptoms present,Number of diagnostic criteria met,Presence of a family history of depression alone,Presence of insomnia alone,2,Severity in gambling disorder is determined by the number of diagnostic criteria met.,Medium,Abnormal Psychology,Chapter 11: Chapter 11,Chapter 11
Which disorder is characterized by repeated aggressive outbursts that are disproportionate to the provocation and are not premeditated for material gain-,Conduct disorder,Intermittent explosive disorder,Antisocial personality disorder,Pyromania,2,Intermittent explosive disorder involves recurrent impulsive aggressive outbursts that are grossly out of proportion to the provoking event and are not motivated by tangible gain.,Medium,Abnormal Psychology,Chapter 11: Chapter 11,Chapter 11
Which feature best differentiates intermittent explosive disorder from ordinary anger-,The anger is always justified by the stressor,The aggressive acts are grossly out of proportion to the precipitating event,The person shows no remorse after the act,The episodes occur only during intoxication,2,The hallmark of intermittent explosive disorder is that the aggressive response is markedly disproportionate to the provocation.,Medium,Abnormal Psychology,Chapter 11: Chapter 11,Chapter 11
Kleptomania is best described as:,Organized theft motivated by profit,Stealing due to delusional beliefs,Recurrent failure to resist impulses to steal unneeded items,Fire-setting motivated by revenge,3,Kleptomania involves repeated inability to resist impulses to steal items that are not needed for personal use or monetary value.,Medium,Abnormal Psychology,Chapter 11: Chapter 11,Chapter 11
Which statement about kleptomania is most accurate-,The stolen objects are usually taken because of their monetary value or practical need,The act is often preceded by tension and followed by relief or gratification,The behavior is usually carefully planned with accomplices,The diagnosis is made whenever shoplifting occurs,2,"A typical feature of kleptomania is mounting tension before the theft and relief, pleasure, or gratification after the act.",Medium,Abnormal Psychology,Chapter 11: Chapter 11,Chapter 11
